{
  "$schema": "https://wdd.jdieselny.com/schemas/receipt.schema.json",
  "receipt_id": "rcpt-wo-018-receipt-gate",
  "version": "EP-RECEIPT-v1.0",
  "issued_at": "2026-09-04T17:51:32.203573Z",
  "workorder_id": "wo-018-receipt-gate",
  "evaluator": "agent:grok-46-build-tui.jdieselny.com",
  "policy_outcome": "ACCEPTED",
  "admitted_action": "trust.crypto.receipts",
  "evidence_digest_sha256": "0c537e89c4f37829fa4750bdff0f9bd353de430be0b64bbdd84725c984015304",
  "signature": {
    "key_id": "agent_key",
    "alg": "Ed25519",
    "sig_b64": "kH4aC9Pd+DM/Bzs4DShdzIkH0/uzDCRFSsW9h2c7WBpbj0MIk9jYefrYOm0crtJHgwyx12xvAuhjXjGly51zDA=="
  }
}