{
  "$schema": "https://wdd.jdieselny.com/schemas/receipt.schema.json",
  "receipt_id": "rcpt-wo-029-namespace-decision",
  "version": "EP-RECEIPT-v1.0",
  "issued_at": "2026-09-04T13:40:00Z",
  "workorder_id": "wo-029-namespace-decision",
  "evaluator": "agent:codex.jdieselny.com",
  "policy_outcome": "ACCEPTED",
  "admitted_action": "contract.schema.namespace",
  "evidence_digest_sha256": "e3b0c44298fc1c149afbf4c8996fb92427ae41e4649b934ca495991b7852b855",
  "signature": {
    "key_id": "e3b0c44298fc1c149afbf4c8996fb92427ae41e4649b934ca495991b7852b855",
    "alg": "Ed25519",
    "sig_b64": "e3b0c44298fc1c149afbf4c8996fb92427ae41e4649b934ca495991b7852b855"
  }
}
