{
  "$schema": "https://wdd.jdieselny.com/schemas/receipt.schema.json",
  "receipt_id": "rcpt-wo-000-genesis-audit",
  "version": "EP-RECEIPT-v1.0",
  "issued_at": "2026-09-04T21:10:52.877063Z",
  "workorder_id": "wo-000-genesis-audit",
  "evaluator": "unknown_agent",
  "policy_outcome": "ACCEPTED",
  "admitted_action": "unknown_action",
  "evidence_digest_sha256": "97b759f1b0fd94f74939edf95f28b33bc9f6da302f524c4de71eb2ae52dfb171",
  "signature": {
    "key_id": "agent_key",
    "alg": "Ed25519",
    "sig_b64": "qwLVrmVtE79IVgYJQe+kdGz6Wa/+lpO2CsR6bynIHII8oeMBFAVa76ld5JcQ0tmvYmpNn1sHGuN9igT/Po3FBw=="
  }
}