{
  "$schema": "https://wdd.jdieselny.com/schemas/receipt.schema.json",
  "receipt_id": "rcpt-wo-019-replay-defense",
  "version": "EP-RECEIPT-v1.0",
  "issued_at": "2026-09-04T21:10:52.901083Z",
  "workorder_id": "wo-019-replay-defense",
  "evaluator": "agent:grok-46-build-tui.jdieselny.com",
  "policy_outcome": "ACCEPTED",
  "admitted_action": "trust.crypto.nonce",
  "evidence_digest_sha256": "19c914bcd7ef28aaeb65fb08f7f20d5836f2374c3cb5393faba80420a6b69a2d",
  "signature": {
    "key_id": "agent_key",
    "alg": "Ed25519",
    "sig_b64": "14bIU3lAbqLQEg+GLD730EUOWD8pxFrhMY4H6o11BdgMCOGWuyj/jaIOoixqC9lT6U0PN5cq4zQvghBuohikDw=="
  }
}