{
  "$schema": "https://wdd.jdieselny.com/schemas/receipt.schema.json",
  "receipt_id": "rcpt-wo-026-telemetry-emitter",
  "version": "EP-RECEIPT-v1.0",
  "issued_at": "2026-09-04T18:43:25Z",
  "workorder_id": "wo-026-telemetry-emitter",
  "evaluator": "agent:agy.jdieselny.com",
  "policy_outcome": "ACCEPTED",
  "admitted_action": "telemetry.emitter",
  "evidence_digest_sha256": "4cb11aea4b077fb0e914e7953957fab2b48868e2cc69cc9765a54ac735025b67",
  "signature": {
    "key_id": "agy-dev",
    "alg": "Ed25519",
    "sig_b64": "STUB"
  }
}
