{
  "$schema": "https://wdd.jdieselny.com/schemas/receipt.schema.json",
  "receipt_id": "rcpt-wo-002-intent-processor",
  "version": "EP-RECEIPT-v1.0",
  "issued_at": "2026-09-04T21:10:52.879709Z",
  "workorder_id": "wo-002-intent-processor",
  "evaluator": "agent:opus.jdieselny.com",
  "policy_outcome": "ACCEPTED",
  "admitted_action": "compiler.intent",
  "evidence_digest_sha256": "36c8102fb5562e004eeb581f92bd630a76e8ad1faa7e18914014b237f50acfcf",
  "signature": {
    "key_id": "agent_key",
    "alg": "Ed25519",
    "sig_b64": "TfZk/vxCYiNdNNaCeSWQJvb4arQPa9WK6C/bX0aAxjeA4UsQFKR27l0x/BKk7X7bHWzQkxOSe5LoaP8z1OheAQ=="
  }
}