{
  "$schema": "https://wdd.jdieselny.com/schemas/receipt.schema.json",
  "receipt_id": "rcpt-wo-008-packaging",
  "version": "EP-RECEIPT-v1.0",
  "issued_at": "2026-09-04T21:10:52.887823Z",
  "workorder_id": "wo-008-packaging",
  "evaluator": "agent:codex.jdieselny.com",
  "policy_outcome": "ACCEPTED",
  "admitted_action": "bootstrap.packaging",
  "evidence_digest_sha256": "9cc49abae8ba9059aaf442f3fbc4873a819d4a3552331c871f82dda240356504",
  "signature": {
    "key_id": "agent_key",
    "alg": "Ed25519",
    "sig_b64": "J26FS+BlHMbDbbXPYU4TcaOGZv7FiS/Rr3Fb2cDOFHLSQiy2Let+eXevdQyODCYhx+6RFuBwIUYZ7b09MfGvCw=="
  }
}