{
  "$schema": "https://wdd.jdieselny.com/schemas/receipt.schema.json",
  "receipt_id": "rcpt-wo-006-schema-workorder",
  "version": "EP-RECEIPT-v1.0",
  "issued_at": "2026-09-04T21:10:52.885225Z",
  "workorder_id": "wo-006-schema-workorder",
  "evaluator": "agent:codex.jdieselny.com",
  "policy_outcome": "ACCEPTED",
  "admitted_action": "contract.schema.workorder",
  "evidence_digest_sha256": "7ed60f20e1882b71c74c6106a9e67f693f8fd4b937419387bd0a860d74024f48",
  "signature": {
    "key_id": "agent_key",
    "alg": "Ed25519",
    "sig_b64": "hO2ZJOej5mAscT+pgPKNi/uwhpCH9M7ozZ9qCOX3IE/IIC3Hn1RD3aKUDjuYeNS2lXQIqGWJhKEeWLOJfkfSCQ=="
  }
}